{
  "schema": "1.0",
  "run": { "id": "r-1", "agent_version": "0.2.0", "started_at": "2026-10-24T13:05:00.250Z", "route_at_event": true, "route_ready_ms": 0, "attempt": 2, "batch": 1, "final": false, "warnings": ["missing_column:Bookmark.Color"] },
  "device": { "firmware": null, "model_id": null, "arch": "arm" },
  "upserts": {
    "annotations": [],
    "words": [ { "id": "—", "h": "0123456789abcdef", "volume_id": null, "dict_suffix": null, "created": null } ],
    "books": []
  }
}
