{
  "schema": "1.0",
  "run": {
    "id": "r-20261024T130500Z-1a2b", "agent_version": "0.2.0", "started_at": "2026-10-24T13:05:00Z",
    "route_at_event": false, "route_ready_ms": 1840, "attempt": 1, "batch": 1, "final": true, "warnings": []
  },
  "device": { "firmware": "4.46.23836", "model_id": "00000000-0000-0000-0000-000000000391", "arch": "arm" },
  "upserts": {
    "annotations": [
      {
        "id": "3f1c2a9e-0d4b-4c51-9a77-2c3d4e5f6a7b", "h": "9f2c1a0b3d4e5f60",
        "volume_id": "file:///mnt/onboard/Books/Phrasebook.epub",
        "content_id": "file:///mnt/onboard/Books/Phrasebook.epub#(5)OEBPS/Text/c01.xhtml",
        "chapter_title": "At the market", "type": "highlight",
        "text": "How much does this cost?\n¿Cuánto cuesta esto?", "annotation": null,
        "start_path": "OEBPS/Text/c01.xhtml#point(/1/4/2/505:1)", "end_path": "OEBPS/Text/c01.xhtml#point(/1/4/2/507:20)",
        "chapter_progress": 0.42, "color": 0, "hidden": false, "created": "2026-09-19T15:05:59.819", "modified": null
      },
      {
        "id": "b7e0c6d2-11aa-4f0e-8c3b-5d6e7f8091a2", "h": "0011223344556677",
        "volume_id": "file:///mnt/onboard/Books/Novel.epub", "content_id": "file:///mnt/onboard/Books/Novel.epub#(3)OEBPS/ch3.xhtml",
        "chapter_title": null, "type": "note", "text": "a snazzy little number", "annotation": "elegante, vistoso",
        "start_path": "OEBPS/ch3.xhtml#point(/1/4/12/3:7)", "end_path": "OEBPS/ch3.xhtml#point(/1/4/12/3:29)",
        "chapter_progress": 0.1, "color": 2, "hidden": false, "created": "2026-09-20T10:00:00.000", "modified": "2026-09-20T10:01:12.000"
      }
    ],
    "words": [
      { "id": "snazzy,", "h": "a1b2c3d4e5f60718", "volume_id": "file:///mnt/onboard/Books/Novel.epub", "dict_suffix": "-en", "created": "2026-10-01T08:12:44Z" }
    ],
    "books": [
      { "id": "file:///mnt/onboard/Books/Novel.epub", "h": "fedcba9876543210", "title": "A Novel", "author": "Jane Doe", "language": "en-US", "position": "OEBPS/ch3.xhtml#point(/1/4/14/1:0)" }
    ]
  },
  "manifest": {
    "annotations": { "3f1c2a9e-0d4b-4c51-9a77-2c3d4e5f6a7b": "9f2c1a0b3d4e5f60", "b7e0c6d2-11aa-4f0e-8c3b-5d6e7f8091a2": "0011223344556677" },
    "words": { "snazzy,": "a1b2c3d4e5f60718", "Snazzy": "1111222233334444" },
    "books": { "file:///mnt/onboard/Books/Novel.epub": "fedcba9876543210", "file:///mnt/onboard/Books/Phrasebook.epub": "5555666677778888" }
  }
}
